INPUT:story	INPUT:system	INPUT:content_plan_id	OUTPUT:category	GOLDEN:category	HINT:text	HINT:default_language	ASSIGNMENT:link	ASSIGNMENT:task_id	ASSIGNMENT:assignment_id	ASSIGNMENT:worker_id	ASSIGNMENT:status	ASSIGNMENT:started
The people of Fulford are convinced that an ancient city hidden deep beneath their village was built to house a great evil, the spirit from an ancient, evil god. But the people of the town, the townspeople of Fulbury, are not convinced. In fact, the people, the local community, think Tom and his twin brother, Dee, are the cause of all the disappearances and all the problems that have come to Fulbury since the beginning of time. Dee and Tom are in the middle of a battle to save their home, their family, their town and themselves.	scratchplot	16	5				https://toloka.yandex.ru/task/32262380/0001ec48ec--62296c738900d230dbe3e8cc	bb8ed41b-a7aa-4325-a476-5e53f097d45d	0001ec48ec--62296c738900d230dbe3e8cc	6ba4a0982299c0f305f25a9a9096776b	APPROVED	2022-03-10T03:11:47.224
I was a very fat man. I decided to start exercising. I started to lose weight. I exercised. I lost weight.	plan-and-write	36	5				https://toloka.yandex.ru/task/32262380/0001ec48ec--62296c7b4fce190ebda7290d	b180dc11-6308-47c8-b568-712da75755d4	0001ec48ec--62296c7b4fce190ebda7290d	4fcec748108d9b79c2b0e8ddf3071d93	APPROVED	2022-03-10T03:11:55.121
Tim was overweight. He decided to start exercising. He started to lose weight. He exercised. He lost weight.	plan-and-write	1	3				https://toloka.yandex.ru/task/32262380/0001ec48ec--62296c8b8900d230dbe3e98d	c11b7d3a-ff7c-41fa-a173-8665e24aa6d8	0001ec48ec--62296c8b8900d230dbe3e98d	f565d051dae61a934598e2217f8b1c58	APPROVED	2022-03-10T03:12:11.745
"Batman, in the guise of a homeless man, is attacked by a crazed woman named Linda Green. As Linda fights Batman, his identity is exposed. Batman and the other heroes rush to her aid and Linda uses a special power to summon a mysterious and powerful creature from the sea called the sea monster."" The sea monster emerges from the water and attacks Batman, and Batman is forced to call upon his friends. When the heroes arrive, the sea monster appears and defeats them. The heroes and the sea creature have a battle. Batman has no choice but to sacrifice his life to destroy the sea thing. Meanwhile, Linda is taken to the asylum where her friends are waiting."	scratchplot	31	3				https://toloka.yandex.ru/task/32262380/0001ec48ec--62296c984a82ca09cd18db55	be648d10-6172-4788-ab72-c19e65d30950	0001ec48ec--62296c984a82ca09cd18db55	4f0f1c7b516d81490c4ab639c6aaa720	APPROVED	2022-03-10T03:12:24.864
I wanted to get a new job. I decided to go to a local coffee shop. I went to the coffee shop for months. I started to feel confident. I felt better.	plan-and-write	4	2				https://toloka.yandex.ru/task/32262380/0001ec48ec--62296c9d1315ef143e392a3e	144f8727-1e74-4464-b0c4-ea24774f3fca	0001ec48ec--62296c9d1315ef143e392a3e	6ba4a0982299c0f305f25a9a9096776b	APPROVED	2022-03-10T03:12:29.613
It all began with the idea that Michael and his friend Maeve need more friends. Michael's grandfather had recently passed away and he needed to find a friend to fill the void. Unfortunately Michael's old friend Maevis is the type who doesn't get along with others and she won't even go with Michael to school. Maevis has been in the past when Michael had needed someone to go with. But that wasn't the worst of it because Maevis also doesn't have a boyfriend. Michael and Maeve became best friends, and the rest of their lives were filled with friendship and love.	scratchplot	37	3				https://toloka.yandex.ru/task/32262380/0001ec48ec--62296cb18afce042b4c4b57b	14ffeeea-38cc-4948-bbf5-c26885fb2f9a	0001ec48ec--62296cb18afce042b4c4b57b	ade066e604e93b213e44e3030eef7f39	APPROVED	2022-03-10T03:12:49.508
The people of Fulford are convinced that an ancient city hidden deep beneath their village was built to house a great evil, the spirit from an ancient, evil god. But the people of the town, the townspeople of Fulbury, are not convinced. In fact, the people, the local community, think Tom and his twin brother, Dee, are the cause of all the disappearances and all the problems that have come to Fulbury since the beginning of time. Dee and Tom are in the middle of a battle to save their home, their family, their town and themselves.	scratchplot	16	4				https://toloka.yandex.ru/task/32262380/0001ec48ec--62296cb1eefaa33c9da12088	bb8ed41b-a7aa-4325-a476-5e53f097d45d	0001ec48ec--62296cb1eefaa33c9da12088	f565d051dae61a934598e2217f8b1c58	APPROVED	2022-03-10T03:12:49.510
Tom was feeling sick. He decided to go to a gym. He started to lose weight. Eventually he did a lot of weight. Tom felt much better.	plan-and-write	47	5				https://toloka.yandex.ru/task/32262380/0001ec48ec--62296cc4a9ea9b57ccc6eeeb	f7985437-e012-4361-b5dc-03ffd7568ba2	0001ec48ec--62296cc4a9ea9b57ccc6eeeb	22a56f02e15c79249fac3bc881417469	APPROVED	2022-03-10T03:13:08.046
I wanted to get a new car. I decided to buy a new car. I bought a new car. I spent the entire weekend driving. I had a great time.	plan-and-write	6	1				https://toloka.yandex.ru/task/32262380/0001ec48ec--62296cc4adf82f6efc11ea4c	2032ee3b-8c2a-4098-93f4-2b6dffd40e7e	0001ec48ec--62296cc4adf82f6efc11ea4c	6ba4a0982299c0f305f25a9a9096776b	APPROVED	2022-03-10T03:13:08.255
Tom wanted to be a doctor. He decided to go to a local college. He made a lot of money. After months of hard work, he was able to get a job. Eventually, tom was able to get a job.	plan-and-write	8	2				https://toloka.yandex.ru/task/32262380/0001ec48ec--62296cccb1874329811d575b	dd58b744-34e3-41db-aeca-f11076bf2d08	0001ec48ec--62296cccb1874329811d575b	4f0f1c7b516d81490c4ab639c6aaa720	APPROVED	2022-03-10T03:13:16.730
It was a beautiful day. Adolf Hitler was having a picnic with his favorite granddaughter, Nestora. The two of them were walking through the woods when they encountered a young woman. The woman was a maid, who was waiting for the master of the house to come out. Adolf, his granddaughter, and the maid walked into a house. The house belonged to a wealthy merchant. When Adolf and Nestor went into the kitchen, they saw a woman cooking dinner. At the dinner table, Adolf looked up at the ceiling. He turned and saw the dark face of his granddaughter. He was horrified. He ran out of the room and locked the door.	scratchplot	14	4				https://toloka.yandex.ru/task/32262380/0001ec48ec--62296cd7655dc258c5bf3592	dd61444c-fce0-43fa-8df2-511aac23a3a1	0001ec48ec--62296cd7655dc258c5bf3592	f565d051dae61a934598e2217f8b1c58	APPROVED	2022-03-10T03:13:27.343
Tom was a very overweight man. He decided to lose weight. He started to lose weight. He went to a diet. He gained weight.	plan-and-write	35	1				https://toloka.yandex.ru/task/32262380/0001ec48ec--62296cd8818b5c5371fc5170	a38ca6b3-0098-43e6-b6fe-1bba76efd1a8	0001ec48ec--62296cd8818b5c5371fc5170	4fcec748108d9b79c2b0e8ddf3071d93	APPROVED	2022-03-10T03:13:28.060
I wanted to get a new job. I decided to go to a local coffee shop. I went to the coffee shop for months. I started to feel confident. I felt better.	plan-and-write	4	1				https://toloka.yandex.ru/task/32262380/0001ec48ec--62296cdcc72a824e5bb4808c	144f8727-1e74-4464-b0c4-ea24774f3fca	0001ec48ec--62296cdcc72a824e5bb4808c	1c8b1038b5ffeb38c0e2ebf8f7b4c666	APPROVED	2022-03-10T03:13:32.283
Jack and Dora Green, the daughter of a major newspaper publisher, live in the Gotham Mansion, the home of Jack's business partner, Doree Green, and the mother of their three-year old daughter, Dora. Their home is a large home with a large lawn. A large stone sculpture of a man stands at the front of the front door, which is marked with a red paint that is difficult to remove without destroying the painting. It was a beautiful day, sunny and warm. The grass was green and lush. The air was clear, and crisp. It was the perfect summer day.	scratchplot	1	5				https://toloka.yandex.ru/task/32262380/0001ec48ec--62296cde1315ef143e392e05	835c60b2-d956-40f5-97c3-b28133dec375	0001ec48ec--62296cde1315ef143e392e05	6ba4a0982299c0f305f25a9a9096776b	APPROVED	2022-03-10T03:13:34.148
In the spring of 1970, George Jones' wife Jane died, and George sought employment in the construction field. He was hired by a contractor named Richard Wurtzel, who had a project in the works for the state. The state needed to build an office building, so Wurtlzle proposed the Joneses would build a state office building on their land. The construction site for the project was a field west of George's house. They built it, and they had a great deal of problems with it. So they got rid of it.	scratchplot	23	1				https://toloka.yandex.ru/task/32262380/0001ec48ec--62296cdf0491a43cbd6e91df	9e612d39-5f6e-4be9-940d-6c12c5cbc967	0001ec48ec--62296cdf0491a43cbd6e91df	22a56f02e15c79249fac3bc881417469	APPROVED	2022-03-10T03:13:35.094
I had to lose some weight. I decided to try out for a gym. I went to the gym and got a diet. I started to lose weight. I ate a lot of food.	plan-and-write	23	4				https://toloka.yandex.ru/task/32262380/0001ec48ec--62296ce1655dc258c5bf35c9	893507da-a768-49dd-a763-24fa341a839a	0001ec48ec--62296ce1655dc258c5bf35c9	4f0f1c7b516d81490c4ab639c6aaa720	APPROVED	2022-03-10T03:13:37.533
Jack and Dora Green, the daughter of a major newspaper publisher, live in the Gotham Mansion, the home of Jack's business partner, Doree Green, and the mother of their three-year old daughter, Dora. Their home is a large home with a large lawn. A large stone sculpture of a man stands at the front of the front door, which is marked with a red paint that is difficult to remove without destroying the painting. It was a beautiful day, sunny and warm. The grass was green and lush. The air was clear, and crisp. It was the perfect summer day.	scratchplot	1	5				https://toloka.yandex.ru/task/32262380/0001ec48ec--62296cef7a07670e20f37a44	835c60b2-d956-40f5-97c3-b28133dec375	0001ec48ec--62296cef7a07670e20f37a44	22a56f02e15c79249fac3bc881417469	APPROVED	2022-03-10T03:13:51.332
I wanted to lose weight. I decided to start exercising. I tried out for months. Eventually, i was able to lose weight. I lost weight.	plan-and-write	15	5				https://toloka.yandex.ru/task/32262380/0001ec48ec--62296cf04fce190ebda72dd7	e1af4962-2f9e-45f5-b880-1184ff594932	0001ec48ec--62296cf04fce190ebda72dd7	4f0f1c7b516d81490c4ab639c6aaa720	APPROVED	2022-03-10T03:13:52.267
Tim wanted to lose weight. He decided to start eating healthier food. He started eating healthy foods. He ate a lot of weight. He was able to lose weight.	plan-and-write	41	1				https://toloka.yandex.ru/task/32262380/0001ec48ec--62296cf29223e2714bd1f7c3	19c34415-d014-4b34-a6a6-f44ac427e261	0001ec48ec--62296cf29223e2714bd1f7c3	22a56f02e15c79249fac3bc881417469	APPROVED	2022-03-10T03:13:54.789
I decided to lose weight and lose weight. I started eating healthy foods. I went to the gym. I exercised for a while. I lost weight.	plan-and-write	25	5				https://toloka.yandex.ru/task/32262380/0001ec48ec--62296cf5ff125b16a45c8fd5	3028e34f-4813-4fa1-a71c-c008aca25cab	0001ec48ec--62296cf5ff125b16a45c8fd5	22a56f02e15c79249fac3bc881417469	APPROVED	2022-03-10T03:13:57.958
Tom wanted to be a doctor. He decided to go to a local college. He made a lot of money. After months of hard work, he was able to get a job. Eventually, tom was able to get a job.	plan-and-write	8	1				https://toloka.yandex.ru/task/32262380/0001ec48ec--62296cf98900d230dbe3ecb1	dd58b744-34e3-41db-aeca-f11076bf2d08	0001ec48ec--62296cf98900d230dbe3ecb1	22a56f02e15c79249fac3bc881417469	APPROVED	2022-03-10T03:14:01.026
I wanted to get a new car. I decided to buy a new one. I bought a new car. It took me four months. I was happy.	plan-and-write	34	5				https://toloka.yandex.ru/task/32262380/0001ec48ec--62296cfc5af44b5d7e55077a	8367caa4-db4e-4697-b4bd-74a6f08337e6	0001ec48ec--62296cfc5af44b5d7e55077a	22a56f02e15c79249fac3bc881417469	APPROVED	2022-03-10T03:14:04.117
I wanted to be a chef. I decided to go to a local restaurant. I watched the movie. Eventually i got a job. I made a lot of money.	plan-and-write	44	2				https://toloka.yandex.ru/task/32262380/0001ec48ec--62296cfcb50edb0927f48890	b1061993-245d-4383-abb5-369875d9a098	0001ec48ec--62296cfcb50edb0927f48890	4f0f1c7b516d81490c4ab639c6aaa720	APPROVED	2022-03-10T03:14:04.876
I wanted to lose weight. I decided to start exercising. I tried out for months. Eventually, i was able to lose weight. I lost weight.	plan-and-write	15	1				https://toloka.yandex.ru/task/32262380/0001ec48ec--62296cffadf82f6efc11ee09	e1af4962-2f9e-45f5-b880-1184ff594932	0001ec48ec--62296cffadf82f6efc11ee09	22a56f02e15c79249fac3bc881417469	APPROVED	2022-03-10T03:14:07.203
Tom wanted to be a doctor. He decided to go to a local college. He made a lot of money. After months of hard work, he was able to get a job. Eventually, tom was able to get a job.	plan-and-write	8	3				https://toloka.yandex.ru/task/32262380/0001ec48ec--62296d01b1874329811d59e0	dd58b744-34e3-41db-aeca-f11076bf2d08	0001ec48ec--62296d01b1874329811d59e0	6ba4a0982299c0f305f25a9a9096776b	APPROVED	2022-03-10T03:14:09.370
One of the most dangerous beings known to humans, Jose is a fierce, bloodthirsty dog who fights with the intention of killing his opponents. He is one of the few humans that can understand a dog's language, and has a very powerful psychic link to the world of the dogs. After years of living with Jose and fighting against all odds, Joan discovers that she is his daughter. But with the dog's power comes his wrath, and Jose is quick to kill. She had to live with him. They had been lovers for a long time, but she had never wanted anything more than to see him dead.	scratchplot	7	5				https://toloka.yandex.ru/task/32262380/0001ec48ec--62296d024fce190ebda72f04	75527626-54a3-4e95-af20-ed2acb326c67	0001ec48ec--62296d024fce190ebda72f04	22a56f02e15c79249fac3bc881417469	APPROVED	2022-03-10T03:14:10.220
Sam wanted to go to the movies. He decided to go to the movie theater. He started to see a movie. Eventually he got to see the movie. He lost his movie.	plan-and-write	39	1				https://toloka.yandex.ru/task/32262380/0001ec48ec--62296d059503bf6b99fd9236	eed9951c-bb9d-4aec-a21f-d0c8739f2f2b	0001ec48ec--62296d059503bf6b99fd9236	22a56f02e15c79249fac3bc881417469	APPROVED	2022-03-10T03:14:13.702
The only reason Mark Smith made it through his whole life without killing himself was because he was able to be in two places at the same time. Mark Smith was the last of his kind, the last living survivor of the original colony, the world-famous planet Earth. In his new life, Mark Smith has been living in California. He works in a restaurant, runs a small business and tries to enjoy life. A year has passed since the events of The Day the Earth Stood Still.	scratchplot	25	5				https://toloka.yandex.ru/task/32262380/0001ec48ec--62296d09eefaa33c9da12576	44abf425-bf49-447e-9b37-cd9b65aa98fa	0001ec48ec--62296d09eefaa33c9da12576	4f0f1c7b516d81490c4ab639c6aaa720	APPROVED	2022-03-10T03:14:17.967
The first day of the New Year, Evelyn woke up in her bedroom and saw that her husband, Peter Hagan, had gone out with a woman. It was the first time in their two-year marriage that Evelyn had been out with anyone but her husband. The last time was the day she gave birth to their baby, the last time she had been alone with her thoughts, but that day, everything had changed. It was the last thing she wanted to do. She hated her job. She couldn't stand it. It had to end, but she couldn't think of a way to do it.	scratchplot	46	1				https://toloka.yandex.ru/task/32262380/0001ec48ec--62296d10de31052c5f314534	ade9229e-5210-46ba-85f9-0df91926d4b2	0001ec48ec--62296d10de31052c5f314534	4fcec748108d9b79c2b0e8ddf3071d93	APPROVED	2022-03-10T03:14:24.639
"Batman, in the guise of a homeless man, is attacked by a crazed woman named Linda Green. As Linda fights Batman, his identity is exposed. Batman and the other heroes rush to her aid and Linda uses a special power to summon a mysterious and powerful creature from the sea called the sea monster."" The sea monster emerges from the water and attacks Batman, and Batman is forced to call upon his friends. When the heroes arrive, the sea monster appears and defeats them. The heroes and the sea creature have a battle. Batman has no choice but to sacrifice his life to destroy the sea thing. Meanwhile, Linda is taken to the asylum where her friends are waiting."	scratchplot	31	5				https://toloka.yandex.ru/task/32262380/0001ec48ec--62296d204a82ca09cd18e178	be648d10-6172-4788-ab72-c19e65d30950	0001ec48ec--62296d204a82ca09cd18e178	f565d051dae61a934598e2217f8b1c58	APPROVED	2022-03-10T03:14:40.196
I was overweight. I decided to go to the gym. I made a lot of weight. I started to lose weight. I had a lot of weight.	plan-and-write	33	1				https://toloka.yandex.ru/task/32262380/0001ec48ec--62296d208900d230dbe3edcb	cb8c323b-eac0-47fd-be12-ec73e439e1d3	0001ec48ec--62296d208900d230dbe3edcb	6ba4a0982299c0f305f25a9a9096776b	APPROVED	2022-03-10T03:14:40.867
Tom wanted to be a doctor. He decided to start working out. He worked hard for months. Eventually he was able to get a job. Tom felt much better after that.	plan-and-write	19	2				https://toloka.yandex.ru/task/32262380/0001ec48ec--62296d2c82605f64962a4e50	fbe366b8-0e65-4c57-8046-1c6dd9b991cd	0001ec48ec--62296d2c82605f64962a4e50	4f0f1c7b516d81490c4ab639c6aaa720	APPROVED	2022-03-10T03:14:52.767
When Nanette was a child, her father and stepmother were killed in a horrific car accident. They were buried in a shallow grave and she was left to raise her brother and sister. One day, a new neighbor named Mark Prentchard showed up at her home and introduced himself to Nanette. Mark offered to buy Nanette's dog and take her on a walk to find a dead body. Nanette was left on her own and she walked for days. She found her father's body, buried deep inside a small hollow in the forest. A few days after that, she found a dead squirrel, too.	scratchplot	13	1				https://toloka.yandex.ru/task/32262380/0001ec48ec--62296d2e8fd2c4357eee2d19	e37dd395-b932-46f4-a856-607e260b81ce	0001ec48ec--62296d2e8fd2c4357eee2d19	1c8b1038b5ffeb38c0e2ebf8f7b4c666	APPROVED	2022-03-10T03:14:54.083
I had to lose some weight. I decided to start eating healthier food. After a few months, i was able to lose weight. I started eating healthy foods. I went to the gym to get a new diet.	plan-and-write	24	2				https://toloka.yandex.ru/task/32262380/0001ec48ec--62296d305b075e1d27d16a63	def5d56d-a38d-451a-a728-d3cf139d470b	0001ec48ec--62296d305b075e1d27d16a63	6ba4a0982299c0f305f25a9a9096776b	APPROVED	2022-03-10T03:14:56.809
The first day of the New Year, Evelyn woke up in her bedroom and saw that her husband, Peter Hagan, had gone out with a woman. It was the first time in their two-year marriage that Evelyn had been out with anyone but her husband. The last time was the day she gave birth to their baby, the last time she had been alone with her thoughts, but that day, everything had changed. It was the last thing she wanted to do. She hated her job. She couldn't stand it. It had to end, but she couldn't think of a way to do it.	scratchplot	46	3				https://toloka.yandex.ru/task/32262380/0001ec48ec--62296d4537825f2adb417863	ade9229e-5210-46ba-85f9-0df91926d4b2	0001ec48ec--62296d4537825f2adb417863	4f0f1c7b516d81490c4ab639c6aaa720	APPROVED	2022-03-10T03:15:17.728
In the small Irish town of Ardbeg, two teenagers are caught up in the struggle of two warring families over the fate of the town's last mine. As the war between the families rages, both families become desperate. They turn to their young men, young women, and children, hoping for the salvation of the mine. The two teenagers, Patrick John McGaughey and Cheryl Gannon, have no choice in the matter, as their fate is decided for them at birth. The children of the families had to choose between their parents, a fate that is more than they can bear. As children, they had no choice. They had to kill their parents.	scratchplot	21	4				https://toloka.yandex.ru/task/32262380/0001ec48ec--62296d4c3c3d413ca065d1a1	d84ac648-5cad-46d6-b4ab-06e35393f55d	0001ec48ec--62296d4c3c3d413ca065d1a1	f565d051dae61a934598e2217f8b1c58	APPROVED	2022-03-10T03:15:24.727
When Khadijah was about to go to the wedding of John H., John took her to the house of Abraham and had sex with her. He had to take an oath of chastity for Khadiyah to enter the new city called Ur of the Chaldees. Then John brought her to Jerusalem, where she fell in love with Solomon, who was a great prophet. But she was not interested in marrying him. In the beginning God created the heaven and the earth. And the earth was without form, and void; and darkness was upon the face of the deep. And God said, Let there be light; and there was light.	scratchplot	3	1				https://toloka.yandex.ru/task/32262380/0001ec48ec--62296d5e8900d230dbe3ef89	d5d9244a-73a9-4381-bdd2-9fdc14fdd9a7	0001ec48ec--62296d5e8900d230dbe3ef89	4fcec748108d9b79c2b0e8ddf3071d93	APPROVED	2022-03-10T03:15:42.082
Tim wanted to lose weight. He decided to start eating healthier food. He started eating healthy foods. He ate a lot of weight. He was able to lose weight.	plan-and-write	41	5				https://toloka.yandex.ru/task/32262380/0001ec48ec--62296d645af44b5d7e550b09	19c34415-d014-4b34-a6a6-f44ac427e261	0001ec48ec--62296d645af44b5d7e550b09	1c8b1038b5ffeb38c0e2ebf8f7b4c666	APPROVED	2022-03-10T03:15:48.828
The people of Fulford are convinced that an ancient city hidden deep beneath their village was built to house a great evil, the spirit from an ancient, evil god. But the people of the town, the townspeople of Fulbury, are not convinced. In fact, the people, the local community, think Tom and his twin brother, Dee, are the cause of all the disappearances and all the problems that have come to Fulbury since the beginning of time. Dee and Tom are in the middle of a battle to save their home, their family, their town and themselves.	scratchplot	16	5				https://toloka.yandex.ru/task/32262380/0001ec48ec--62296d81eefaa33c9da12c91	bb8ed41b-a7aa-4325-a476-5e53f097d45d	0001ec48ec--62296d81eefaa33c9da12c91	1c8b1038b5ffeb38c0e2ebf8f7b4c666	APPROVED	2022-03-10T03:16:17.950
Tom was a new job at a new school. He decided to start working. He started to work hard. Eventually he was able to get a job. Tom ended up with a new job.	plan-and-write	5	2				https://toloka.yandex.ru/task/32262380/0001ec48ec--62296d93818b5c5371fc5834	6087d9f5-199d-46f4-ab73-11d4cfa2b5b2	0001ec48ec--62296d93818b5c5371fc5834	f565d051dae61a934598e2217f8b1c58	APPROVED	2022-03-10T03:16:35.392
I had to lose some weight. I decided to try out for a gym. I went to the gym and got a diet. I started to lose weight. I ate a lot of food.	plan-and-write	23	1				https://toloka.yandex.ru/task/32262380/0001ec48ec--62296dbb655dc258c5bf3ce7	893507da-a768-49dd-a763-24fa341a839a	0001ec48ec--62296dbb655dc258c5bf3ce7	4fcec748108d9b79c2b0e8ddf3071d93	APPROVED	2022-03-10T03:17:15.051
Tom wanted to be a doctor. He decided to start working out. He worked hard for months. Eventually he was able to get a job. Tom felt much better after that.	plan-and-write	19	1				https://toloka.yandex.ru/task/32262380/0001ec48ec--62296ddd1315ef143e393ab0	fbe366b8-0e65-4c57-8046-1c6dd9b991cd	0001ec48ec--62296ddd1315ef143e393ab0	4fcec748108d9b79c2b0e8ddf3071d93	APPROVED	2022-03-10T03:17:49.161
"A new world is dawning. The human race is becoming extinct, a plague of zombies has infected all humans and has now turned its attention on Washoe. The only known cure is the creation of a Washoe virus"" and the only known person who can create this virus is Benjamin. Brother and Sister have to save their family and find the cure before the virus can destroy them. Benjamin, in his final attempt to create the virus, has found a mysterious old man in the woods. Benjamin has a choice to make. Will he create the Washoe Virus?"	scratchplot	11	4				https://toloka.yandex.ru/task/32262380/0001ec48ec--62296df0655dc258c5bf3e5e	2aaa2d79-a804-45bf-ac06-aba1b5aeb2eb	0001ec48ec--62296df0655dc258c5bf3e5e	f565d051dae61a934598e2217f8b1c58	APPROVED	2022-03-10T03:18:08.128
David Pines was a handsome young man in his mid-twenties. He had a beautiful wife, Gina Miller. He was a very successful software entrepreneur and he was well-known for his philanthropy. He and Gina were living in San Mateo County, California. The day before David's death, Gina called home to tell him she had something she had to tell David. After she hung up, Gina went to the garage to get something to read to David. The last time she saw him, he had a deep gash on the side of his head that looked like a gunshot wound.	scratchplot	17	5				https://toloka.yandex.ru/task/32262380/0001ec48ec--62296e0a1315ef143e393ca1	8f8dd35e-9294-4e2f-b5f8-3281d30210c0	0001ec48ec--62296e0a1315ef143e393ca1	4fcec748108d9b79c2b0e8ddf3071d93	APPROVED	2022-03-10T03:18:34.071
I was overweight. I decided to start eating healthier food. I started to eat more. After a few months, i started eating healthy food. Eventually, i started eating healthy food.	plan-and-write	27	3				https://toloka.yandex.ru/task/32262380/0001ec48ec--62296e1e5af44b5d7e55113f	84f7e45d-19c5-4f87-a44f-5d4a4d8944c7	0001ec48ec--62296e1e5af44b5d7e55113f	f565d051dae61a934598e2217f8b1c58	APPROVED	2022-03-10T03:18:54.853
I had to lose some weight. I decided to start eating healthier food. After a few months, i was able to lose weight. I started eating healthy foods. I went to the gym to get a new diet.	plan-and-write	24	3				https://toloka.yandex.ru/task/32262380/0001ec48ec--62296e3d469e045138989253	def5d56d-a38d-451a-a728-d3cf139d470b	0001ec48ec--62296e3d469e045138989253	f565d051dae61a934598e2217f8b1c58	APPROVED	2022-03-10T03:19:25.930
