genre,theme,location,actor,actress,story,ending
aeroplane,They can land a plane safely.,Ireland,Tom Fagan,Molly,"When Tom Fagen and his sister Molly Fagan set off from Ireland in a small Cessna airplane for a five-week visit to New York, it was a great adventure. As they flew high above the Atlantic, they were surprised by a thunderstorm. When it cleared, they saw that there was a small town a little way out in the countryside that appeared to be entirely abandoned.",They landed on the runway. Everyone was waiting. And there were no airplanes anywhere...except the ones Tom and Molly had rented.
mystery,It can't be that big a deal!,Ireland,Tom Fagan,Jane,"It's the morning of the wedding of the year. It's the day after the wedding. It is the night before the wedding, and it is the very last day of the marriage. All of that is a lie. The marriage is not a thing. The wedding is just a memory. And it's a terrible one, for both Tom and Jane. But now that they're alone, and everything's over, they both realize that it was their greatest mistake. They both know the truth.",It's the night of the funeral for the wedding.
dystopian,"A man, born to a noble family, becomes an outcast and a vagrant in an underground city.",Northwest Territories,Elliott,Molly,"The man, Elliott, lives in a small town, surrounded by trees and flowers. He is an average student who loves reading and music. He's a good friend of Molly. One day he sees her playing with an older boy, a stranger she barely knows, and he doesn't understand why. She leaves the boy, who is a stranger to her, and she runs away to an underground, underground city. She meets a girl, Molly, and their lives intertwine.","It's a hard life, but he had been born into it, and there was nothing he could do about it, not anymore. He felt a coldness creep into the back of his mind. He couldn't believe that he was a murderer."
the dark forest,The forest was quiet.,Fayette County,Randy Jones,Polly,"When a group of teenagers in the woods learn of a deadly monster, they decide to investigate.
In the woods
They all went off to investigate. And in the end, Polly had to be rescued because she and Randy were being hunted by an old man with a huge club that had a huge blade on the end.",The woods was quiet and the only sounds were the rustle of leaves as they walked and the crunch of gravel under their feet.
science fiction,What makes a hero?,Kathmandu,Cory,Titia,"Cory and Titania have been travelling around the world as tourists. They have made it all the way to Kathmandua, Tibet, and Nepal to experience the various cultures there. The most beautiful city they had seen was Kathmandula.
They arrived at the city on a Sunday. Titania was really excited. Cory was not really in the mood to visit a new place. So she decided to go with her sister.","The sun came out, and it was like a new day for Titania, and she was happy again. The girls went to a local temple to do some rituals, and Cory went to see the famous Shiva temple. It was a beautiful day."
aeroplane,"The pilot, as a rule, always takes the shortest route home.",New York City,John Smith,Mary Anne,"A young girl, Mary Ann Smith, lives with her mother, Mrs. James Smith, and her uncle, Dr. John Smith. Her father died when she was a baby and her mother is living in London. Her aunt is the executrix of her will. Her brother, Dr John Smith, is an American pilot, and she has been visiting him for the last two weeks. Mary Anne Smith is a great admirer of him, and he, in turn, loves her.","It was just about midday when the aircraft came into view. They were going over the Isle of Wight. The pilot, at the controls, was John Smith."
cinema,"The Doctor must leave London and take on a new companion, but the time is right.",North Georgia,John Smith,Hannah Jones,"In 1843, the English Doctor, John Smith, and his companion, Hannah Jones, are called to investigate the mysterious disappearance of a man called John Jones. They have little hope of finding him alive, but after a series of unexplained deaths, they begin to suspect that the murders may be connected with a conspiracy to keep London under the thumb of a powerful group of criminals known as the Ruling Families.","Heaven knows how many people have been killed, but they keep coming, because there's a reason to do it."
dying earth,"Earthquake, Tsunami, Tsavo.",San Francisco,David Lassen,Ruth,"As they walk through the city, David and Ruth are suddenly drawn into a conspiracy involving a new type of seismic machine and an old family. After a series of mysterious events that shake the city and leave David and his family on the brink of disaster, David finds himself in a desperate race to save them, even as the mysterious machine and its potential to bring about an unstoppable tidal wave begins to wreak havoc.","David has finally discovered the secret of the machine, but can it save the city?"
novel for kids,The girl who loves the sun.,Fulford County,Tom,Dee Diggs,"Tom and Dee were so thrilled when they found the perfect place for their daughter to live that they gave their old house to her. But one day the old lady comes in to pick it up and it turns out to be a haunted house. When Tom and Dana discover the secret they are forced to escape the house and escape with Dana to get rid of the ghosts in a car. They learn that it's been the curse of the house all along, but can they escape before it gets too late.","The next morning, they were gone.
Tom was lying in a ditch beside his old house.
Dee, still alive, lay dying on the sidewalk."
haunt,The dead never know the meaning of life.,Dalmani,Eddy,Dalmena,"As the year ended, the night began to get colder and colder. The sun was still shining bright on the mountains, but the sky was a sea of pitch black and dark. Dalmenas' heart was not in it, his spirit just wasn't there to go out and dance the night away, but Eddy's spirit was. He'd never been to a wedding with a girl. He had no reason to be nervous.","The sun set, the moon rose, and the night was gone."
the dark forest,The first step in the way was an unassuming forest path,Northwest Territories,James T. Allen,Tanya,"James T. and his wife Tanya had an uneventful childhood. When they were young, their mother and father were killed, leaving James alone and vulnerable. A few years later, James moved to the small North Eastern town of Haines. When the couple started their relationship, Tanya didn't believe it was serious, and James didn't want to give up on her. However, their relationship gradually grew to be more and more serious.","James is the first to realize the relationship he has with his wife is not normal. He knows his life is on a much more serious scale, but he is unable to let her go because of a belief in his wife and love for her."
aeroplane,"The pilot, as a rule, always takes the shortest route home.",Yukon,Erik,Fiona,"The Yukon has long been a quiet backwater with a small population and few industries. But Erik has dreams of the country's glory, and the prospect of finding a rich partner for a commercial venture in the remote desert town of Eagle Pass makes the idea exciting. After an accident at a construction site leaves him unable to fly, he and Fiona decide to head back to Eagle Pass, in hopes of making a fresh start in their lives.","A lot of people have said that in the future, it'll be the only place on Earth where one can fly,"
bodyscapes,What's the difference between a real-life monster and a cartoon monster?,San Francisco,John Smith,Ruth,"John Smith was a typical young man who fell in love with Ruth and their lives were forever changed when John's best friend, Frank, died from cancer. Now, the two of them have become inseparable. It is during their daily walks that they come across a creature from their childhood dreams, the terrifying creature known as the Bodyscape.
Ascended from the depths of the Bodisland. Created by the ancient and powerful god, Bodis.","After the Bodizcart's death, John and Ruth decided that their best chance of protecting themselves was to get to the top of a tower and hide there."
scifi,There's not a person that could get through a fight with a dog.,California,Tom,Jane,"They walked down the street, and it was the same day. The same house and the same car. It wasn't the same at all. The dog was dead. They didn't know how the dog was killed. There was an open garage door that led out, but when they tried to go out it wouldn't open.
Tom and Jane are talking on the phone about something. Tom is going to be at a job interview tomorrow. Jane has a friend's wedding.","Tom and Joe and Jane and their dog were on the sidewalk waiting for the dog to come back in to the house. The cat, which had wandered into the house, was on the kitchen floor."
mystery,The world of the imagination is the world of fantasy.,New York City,Joe,Jane,"A year after the disappearance of their son, a woman named Jane, a nurse, is hired by the mysterious Mr. T. She is asked by the police to help them solve the murder of Joe, a man she has been seeing on and off for the past few years. It is here that Jane meets and falls in love with Joe's former lover, Mr. H. Joe is a talented and successful photographer but he's had an increasingly difficult time making a living.",There were times when he had no money. He had no hope in a future for himself. And for her it had been no better.
novel for kids,"A novel for children, with illustrations that are either realistic or imaginative,",Gotham,Jason Todd,Candy's Cat,"Jason Todd is a young hero whose adventures take him across Gotham, into the world of his greatest fears and fears. When a crime wave sweeps the city, Jason's best friend, Candy's cat, comes to him in a dream. The dream brings him to the place of the mysterious Catwoman. But as they travel together to confront the evil that rules Gotham, they will learn that not all is as it seems in Gotham City!","After defeating Batman, Jason returns to his old neighborhood, and his cat is nowhere to be seen."
empathy,"He was a tall, thin man with glasses, who had a dark complexion and a full head of hair.",Majuro,Yoshiro,Bryanna,"In Majuro, a small city in the central highlands of the country, where a large number of students attend the public school, there's a girl called Yoshiro. She was a normal high school girl, who loved to read, listen to music and watch the weather. One day, the girl saw a young man dressed in black and wearing a hoodie, who appeared to be carrying a large bag.","As he got off the train, he turned to Yoshino and Bryann, and said, "
aeroplane,Aircraft engines don't have to break on the way down.,North Queensland,John,Jade,"In October 1980, John and his brother, Jamie, were flying over North Queensland in their private Piper Arrow (a Cessna 206B-1). They had been invited to fly over the area by John's friend, Bob Williams. They were flying a night flight of four hours. A sudden gust of wind sent Jamie into a spin, and he ended up upside down on the ground.","The only thing that made it better was that John's father, George, was sitting next to him."
the dark forest,"When the sun goes down, there is only one thing that can be done. Kill the sun.",Kathmandu,Ivan,Nita,"The day of the eclipse, Ivan and the boys were sleeping on the floor of Nita's room. When the sun began to set, the two boys heard an explosion and realized that they were under attack by a swarm of bees, which were attacking them from all sides. They fought back, but in the chaos of the battle, the boys got knocked out and were unable to wake up. They were eventually discovered by a passing car and brought back to the house.",The sun goes up...and the sun never goes down.
scifi,It's just a few minutes of space travel. They've never had to deal with this before.,Palo Alto,Herman Smith,Alice,"A man and a woman are forced to travel to a distant planet, a strange, hostile environment. There they discover the only other inhabitant of this world is a man they've never met. The man, who looks like a cross between the main character of The Outer Limits and a late 20th century James Bond, is Herman Smith. He's an engineer from the future, who has been stranded in the past for some reason. He and Alice (the main character)","They were going to spend the rest of their lives together, until they got stuck in the middle of space."
aeroplane,They can land a plane safely.,Lisbon,Jose,Dorothy,"It is 1933. In a moment of serendipity, a Portuguese airliner crashes on the Portuguese island of Terceira. The wreckage contains one body and several human organs.
The body is that of Jose, a young man who had been traveling to Lisbon, accompanied by his governess, Dorothy, who has no memories of her past. The plane is not only an airplane, but an airplane in the guise of a small plane with a propeller, a parachute, and a wing.","After their flight, they came back to the village. The villagers gave them the clothes that they had worn, and they went on their way. There was no sign of the airplane, and no trace of the body."
science-fiction,It's okay to cry,Washoe County,Ezri Miller,Tia Oke,"Tia and Ezri, along with a bunch of Washoe kids, have been trapped in a desert since the Great Flood that wiped out the first generation of humans. When their home is destroyed, Tia and her friends are left with one option—seek out a new home for themselves. With the help of an old friend and a group of strangers, they take to the skies in a bid to reach the new world.",It is a good thing Tia had been in cryosleep for so long. It wouldn't have made much sense to her if she was already dead.
the great american novel,No one is safe from the government,North Georgia,Tom,Sandra Brown,"In August of 2008, two young women, Tom and Sarah Brown, meet and fall in love during the opening days of the national recession. When the recession ends and the economy begins to rebound, the Brown sisters decide to start their lives together in the tiny, rural town of Whitehall, North Georgia. But soon, Sandra begins to suspect that her older sister might have something to do with all the problems of White Hall, especially the sudden disappearance of Tom's father.",What would the world look like if the government didn't interfere?
mystery,One day at a time.,Kathmandu,Cory,Chhavi,"One night in the middle of Nepal's winter, Cory and a friend, a local girl named Chhavivi, are walking home from a party when they're suddenly attacked by a dog, and both are seriously injured. Chhavinvi is left in a coma, but Cory manages to keep his spirit strong enough to travel to Kathmandua hospital for treatment, where he meets a young woman named Gyanendra who helps him get through the next day.",The end of the day. There's no such thing.
scifi,It is the way of the universe. One cannot be a man and a god.,South Sudan,Benjamin,Khadija,"In the distant future of 2029, a young man named Benjamin and a young woman named Khadijah set out on a journey to discover and find their mother. They come across a mysterious city, a world filled with strange creatures. This strange world is called the Unnamed World. The Unnamed City has many different worlds within it. One world is known as the Unspecified World.",One cannot be the father and mother of two.
cthulhu,The Necronomicon,Kathmandu,Ivan,Titia,"A young girl and her two sisters visit their grandparents in a small village near the Kathmanduan mountains. They are very poor and Titias is hungry. One of the sisters finds a book in their grandfather's library that reads The Book of Shadows"". The young girl, Titia, who is very clever, finds a way to read the words of the book.",It's a good thing the family was too dumb to realize how much trouble Titia was going to make for herself
erotica,"The man is a master at manipulating his environment, but in his case, his environment is his own body.",Lisbon,Jose,Luiz Gomes,"In the summer of 1989, the two were living in the basement of a house in Lisbon. As their lives were becoming more and more intertwined, a strange relationship began to form between the two.
The relationship was one of sexual passion and sexual obsession.
Jose Gomes was a beautiful man with beautiful dreams. He loved to dream about beautiful women and beautiful things, including women and sex.","Jose, Luiz, and the other men of the house, who are all naked in the bedroom, have been together for twenty years."
thrillers,The only person who could have stopped him was the girl with the blue dress.,California,Tom,Nicky,"Tom and Nicki met on a boat trip. As soon as they met, they fell in love and they were soon married.
Tom was born on January 1, 1945, and had just graduated from high school. Nicki was born in August of 1953, and just finished high school in California. She had just turned nineteen.
Both had a lot of potential. They both went to a private school called St. Mary's.
The couple had the most beautiful children.","Tom was working in a factory, and he saw that his wife was being pressured by the factory to make some kind of big money. So he decided to leave the factory and travel the world. His destination? America."
cthulhu,the first sign of the apocalypse was the disappearance of the last of the gods,Afghanistan,Drew,Sarah,"As the group makes their way toward the mountain, Drew spots a pair of small children with the dead bodies of the dead. He tells Sarah to take the children in a van to the hospital. The group begins to follow the van, and Sarah notices the car is not the one she saw earlier. It is the car from her dreams. She calls out for Drew, and he answers. He is on the ground, dead from being shot.","The road to the mountain has been taken. The town is abandoned. The sun sets, and the mountain burns. The road will be burned. The people will die."
science-fiction,It's okay to cry,Afghanistan,Samiullah,Maryam Bibi,"Samiullah is a refugee in a remote village in eastern Afghanistan. He lives with his wife Maryam in a one-room house with a mud floor, no electricity, no running water, a tin water tank and a stove. Maryam is a housekeeper, Sami an illiterate farmer. They both work in the same fields, growing wheat. Both are married and have one child.",It is the night of Sami's wedding.
cthulhu,The End of All Things,Fulford County,John B. Smith,Mary Smith,"The end of all things, or ""The Great Unquiet."" It was an age of great unrest, when strange forces had begun to stir, the world was at war with itself. And now a terrible force had risen to destroy.
Mary Smith had come to the area to look for John, but she had found a creature of the wilds, and she was going to kill it.",The final act of the book is to close with Mary and John and the rest of the children in a graveyard.
fiction,The first time she saw her was the second time she heard it. ,Majuro,Naoi,Sue,"Sue, the girl who was always by Nao in her childhood, had grown up to be the strongest of the Four Heavenly Kings and the leader of the royal guards. But she didn't care for the throne and was always lonely, so she decided to leave Majuro and live somewhere where no one would notice her. One day she was on a bus on the way to the city of Urayama where she lived.",It wasn't long after that. The bus came to a stop. 
the book of job,"In the early part of the year, the ship is on a routine trip to the west coast.",Mack,Trevor Knight,Maeve,"When the captain finds out about his brother's infidelity, he asks him to stay on the ship as his personal guard. Maeve is not interested in staying, but she feels she has to because of Trevor's relationship with Mack and her fear that he might return home and hurt her, as well as possibly her father and brother.
""On the first night of the cruise, as they're about to dock, they're both arrested.","Maeve and Trevor are in the back of a police car, and the car pulls up beside them."
the great american novel,No one is safe from the government,Dalmani,Juan Diaz,Dalmena,"Juan Diaz and his brother Dalmenas were two ordinary workers in the city of Dalmana, but their lives changed the day they were kidnapped by the government. The kidnapping was a government experiment in controlling people with their minds, and it is now known as the experiment of the century."" The government used the Dalmanis as guinea pigs, testing a new form of mental manipulation called ""the brainwashing technique"" on the pair.",Juan Diaz and Dalmena's lives are never the same. The two brothers are torn apart by the memories of their kidnapping. The day they are found by their family is the day their lives are forever changed.
novel for kids,The girl who loves the sun.,North Georgia,John Smith,Hannah Jones,"In the middle of the night a loud noise awoke John Smith from his sleep. It was the sound of an animal. The animal that woke him was a large cat, the size of a dog. He ran into the house and found that Hannah was nowhere to be found. He went into the hallway where he found a large, dark spot. He looked closer and realized that it was a hole in the wall.","The boy in the hole was a big guy, but he was also a boy. He was wearing a black suit with a green tie and he was holding a green umbrella. "
mystery,What does that mean?,Kathmandu,Ivan,Chhavi,"They found a box. Inside the box was a woman named Chhavika. She said she was the mother of a very important girl, who was a spy for the Soviets. Her name is Mira. When the Soviets find out what she is, they have Mira killed. They then take her box and have Ivan, Mira's daughter, kidnap her. After he has the box, he puts it on the floor and opens it up.","Ivan is a very good fighter, but it is impossible to get inside the box."
novel for kids,It's a bright day.,Spain,Adolf Hitler,Luisa,"It was a bright, warm summer day in Spain. Adolf Hitler was sitting outside his favorite spot in the country, gazing out over the mountains and hills. Luisa was at his side, holding a basket of strawberries. She told him that if he wanted to know the future, he had to be brave enough to live it. She asked if he thought he would ever become president.","The President of Germany died in the summer of 1945, surrounded by his friends and family. After the war, Adolf Hitler lived in exile and died in his apartment in the Führerbunker, surrounded in a glass box."
mystery,The world of the imagination is the world of fantasy.,New York City,John Smith,Mary Anne,"Mary Anne and John Smith, the son and mother of an elderly New Yorker in the 1890's, have an uncanny encounter with a ghostly woman who makes her way to a secret cellar where they are trapped until they are discovered and saved by a mysterious and beautiful girl who has the ability to see into the past. The two discover that the woman is a witch and the pair set out to learn more about her.","There were times when it didn't feel like a novel at all; a collection of stories, not a novel."
thrillers,"What can a man do, when he has nothing to gain, and everything to lose?",King County,John Smith,Bella C,"He had not seen his son John since he was four years old. When John first showed up at the school, Bella was afraid to tell him where he lived. She said that he would just be angry, but when she tried to explain that she didn't know, he became more insistent, insisting that he knew where he was. It was hard for him to accept that his father was no longer with him.",They both knew he would not survive the night. And so they left together.
aeroplane,Aircraft are the most efficient forms of mass transport available in the 21st century,Fayette County,James Dean,Jane,"In the early 1950s, in the small town of Fayette, West Virginia, James Dean was living with Jane, his beautiful, troubled wife, and their three young children. Jane was a troubled person, who was in fact suffering from bipolar disorder. She would get mad at anyone and everything and would spend the next two decades in and out of psychiatric hospitals.","In the late summer of 1957, at the height of their relationship, the Dean family took off to fly across the country and see the world"
fantasy,He's so hot and bothered!,South Sudan,Mason Davis,Aisha,"Mason Davis is a young boy in South Africa who dreams of flying through the air on a dragon-powered air scooter. But when a plane crash lands in the middle of a war, the boy's world takes an unexpected turn. The crash is the final straw, and a series of strange events leads Mason to the realization that he is, in fact, in love with Aisha.","The last thing he wanted to do was break up with her. That just wouldn't do. But the more time he spent with her, the more he realized that it was the only way to be with her."
erotica,"The man is a master at manipulating his environment, but in his case, his environment is his own body.",Londraal,Gareth,Londra,"Londra was in a hurry to get somewhere. She knew it was a bad idea to stop and wait. But in her mind, she was already in the right place. She had just entered the inn with Gareth, and he was sitting on the edge of the bed. He was watching her through the peephole, but she had just caught sight of herself in the mirror. She looked at him, her eyes wide and wide open.",The way she looked at the mirror in the reflection made him shiver.
fiction,"Writing is a skill, so don't be a douchebag.",North Georgia,John Smith,Hannah Jones,"It had been a month since John had last seen Hannah, but she'd still been calling him incessantly. And he'd been busy; he was writing a novel. So he decided that he would come home after a long day at work and help her. But then he discovered that her new boyfriend had been stalking her online and he didn't know what to think.","John and Hannah are married, and John has a new baby."
