genre,theme,location,actor,actress,story,ending
literary fiction,The only problem with the house was the people.,San Francisco,Michael Smith,Gina Miller,"Michael and Gina are on their honeymoon in the SF Bay area. But, as they're walking along the Golden Gate Bridge, Michael notices a young man walking his dog. He follows him and, when they walk into a restaurant, the dog suddenly attacks the man, and the dog bites him. He goes to the emergency room and is diagnosed with an intestinal parasite. The doctors tell him that the only problem is the person who owns the dog.",That's the house that people build for themselves.
biblical epic,What was it like?,Cotton County,John Smith,Sophia,"As John Smith was driving to visit Sophia, a flood came upon them. After the flood, Sophia and John Smith got married, and John had a son, John. However, John was left on the road, on his way to visit his mother, his mother's husband and his wife's brother. When he arrived, he found that his mother had already died and his father had become a drunkard. He also found his brother-in-law had become rich and left to the desert.","Sophia, the sister of John Smith. The two brothers, John Smith, and Sophia, are the only survivors. Sophia becomes pregnant and gives birth to John's child."
aeroplane,There is nothing more dangerous than a pilot who's too nervous to do the job.,Washoe County,Harrison Jones,Sister,"On the morning of June 29th, 1976, Captain John Harrison Jones took off from Lake Tahoe with his flight instructor for a training flight. At an altitude of 5,500 feet, Jones' airplane began to fall, but he managed to eject safely before plummeting to the ground. However, he was injured badly and remained in the hospital for several weeks. A few days later, Jones made an unusual request from his wife, Sister Mary.",Sister Mary Jones is about to be married!
fiction,The first time she saw her was the second time she heard it. ,Denmark,Peter Hagen,Evelyn,"In Denmark, Peter Hagan is the first and only person who knows how to make money by cloning human beings. He has a successful company that can clone human beings and sell them for profit. But Evelyn Kavner has heard about his company and is determined to find out what he is doing and what they are cloning. She gets the job of looking after Peter's clones. The job is to get rid of the clones, and Eve gets her chance when she and her colleagues are attacked.","When Evelyn came back to Peter's office, she found him dead."
mystery,A man can be so proud of himself that he will do anything.,North,Mick,Jenny,"Mick and Jenny are in North, having to live without their beloved dogs and find their way back to a quiet and safe life in the suburbs, when they are visited by a friend, a man with a heart of gold named Bob, who has taken in them as his own.
The first few chapters were enjoyable, with Mick and his friends, as well as Bob and the dogs, finding a place to belong in the new environment of suburban America.",The man that would take in these poor lost children found himself in a new world of danger and excitement. His mind was set on one mission. He didn't care that it would cost him everything. He was determined to keep them safe.
dystopian,The future is now.,Dalmani,Bertram,Dalmena,"The past was not forgotten. The present is not what it seems. The future is already here. And it is here, in the ruins of a society that has become its own worst enemy.
Bertram and his father, Dalmenan, the last remaining family in the region of Dalmeno, have lived in fear for decades. They live a life that is so desperate, so desperate they cannot see the reality that it offers.","A man is a coward that doesn't fight, a man is the one who is afraid of being afraid."
dark fantasy,"It's a tale of the dead,",Fayette County,John Smith,Cindy,"The book follows John Smith as he travels through an abandoned mining town in Fentress County and becomes a member of a secret, underground society. Cindy lives and works in a neighboring town, and when she discovers what John is doing, she becomes a rival for his affections and a threat to his safety. But before it can come to blows, John must take action. A group of strangers must band together to save him.",It was like a storm had broken out in the distance and the wind was whipping at us.
science-fiction,It is a small world when people are nice to one another.,King,Michael Jackson,Lila,"The world's leading geneticist, Michael Jackson, is invited to a conference in New York City. A group of young scientists, including Lila Kitzman, are on hand to help him make his presentation. However, during a private tour, Michael discovers Lila is actually a woman. Now he will have to help her accept who she is and become a successful woman, with all the responsibilities that entails.","The world is a strange place. It is a place where people are willing to forgive, a place of forgiveness where people don't think twice about giving up their lives for each other."
biblical epic,"And when Jesus saw it, he was amazed; he fell on his face, and worshiped.",Mendouville,Tom Brown,Shannon Cason,"Tom Brown and his friend Shannon Cisley are on vacation in Mendoza, Argentina. Their plan is to have a few days off, so they are staying at a resort. Shannon and Tom meet a young couple, Manuel and Isabela, in the bar, who say they have an older woman on vacation with them. The older woman has an older boyfriend, but she has the right to be with whoever she wants.","When Jesus saw the young couple kissing and caressing each other, he fell down to the floor and worshiping and saying, 'Worship the LORD!'"
erotica,"To be, or not to be, that is the question. And the answer is... yes",Northwest Territories,James T. Allen,Mary,"A new life, new friends, and new ideas in the Northwest Territories! Mary, James T., and James's father, Dr. John Allen are on the road, but their dreams of seeing their old home, Canada, is still a long way off. As they try to make it there, their journey will lead them through the Northwest Territory to see their parents, and the past and present will be told by their old friend, James.",That is the Question. And that is Answer...yes!
haunt,"A man is on his way to the cemetery, and he sees a man walking the cemetery.",Afghanistan,Ramiro Sanchez,Kali,"Ramiro was a young man in a small town in Afghanistan. He was a soldier, and had recently joined the Afghan National Army. On a normal day, he would have walked to the airport. But this day, his plane had crashed. He had died. His mother was alone. She had come to the U.S. with the hopes that Ramiros would be sent to Iraq. Now she was on her own.","The cemetery is full of soldiers. There is a man in one corner of the cemetery. He wears a brown shirt, has a beard, and a beard that looks like it has come straight from the grave."
science-fiction,The only way to defeat the enemy is to become the enemy.,Alameda County,Sam Smith,Cheryl,"A young man and a young woman are brought together by a mysterious force. The young man, Sam Smith, becomes obsessed with the woman, Cheryl Corley, and he soon finds that he must fight the forces that hold her captive to save his life and hers.
Awards/Recognition
Winner of the 2010 Audie Award for Science Fiction, and a 2011 Hugo Award for Best Dramatic Presentation. The 2011 Locus Award for Outstanding Dramatic Work in Science Fiction.",The future is no place for Sam Smith. The past is no longer an escape. This is the end of the line.
cthulhu,It can't be done,Mendouville,Tom Brown,Fanny,"After a terrifying encounter with the legendary creature known as 'The Thing', Tom Brown (Ben Affleck) is forced to make his way into the mysterious world of the Deep Ones to stop the spread of a plague. There, he meets Fanny (Zoe Saldana), a human who has been cursed with the ability to transform into a monstrous version of herself. With only the help of her best friend (Hugh Jackman)","He is an alien, and the world is an endless ocean"
scifi,It is the way of the universe. One cannot be a man and a god.,Ireland,David,The White Queen,"David is a human. One of the few who can wield the powers of God. But his godly powers are a secret, and those that know about them fear him. David and Queen are a married couple. David is not the ideal husband. A few people in Ireland know that David is a god, but most are afraid. David's wife is in hiding. She has been taken to the United States with their son. She refuses to tell David her secret and David is furious.","It was a cold, dark winter's night. The Queen was sleeping on David's shoulder, their son in his cradle. When he woke up and saw her, he said, "
thrillers,The only person who could have stopped him was the girl with the blue dress.,Fayette County,Randy Jones,Polly,"A young man and a young woman are living in the small rural town of Pikesville, Indiana. One night while sleeping, they see a mysterious, blue-eyed man with a white beard appear in their bedroom window. Randy Jones is a young man who has been in and out of jail for burglary charges. Polly Jones is Polly's younger sister, a woman of great faith. They decide that if Randy Jones can stop the man, they can stop themselves.","The girl in the blue-dress had no idea how she had ended up in this situation. She was scared and confused, and she had no desire to be the one to kill him. She had just fallen in love with the man."
dark fantasy,The Lord of the Rings,Bran,Odd,Lady Arya,"When Odd and Lord Baelor (the former King Robert Baratheon's bastard son) meet, it is a love that will change the face of the Seven Kingdoms. Lady Aryaaaa, a noble and beautiful noblewoman from the Vale of Arryn, and the bastard son of King Robert, is not sure she can trust a Stark, so she arranges to meet her future husband, Lord Brienne of Tarth, one of the knights of the Kingsguard.","It had taken him only a short time to make up his mind to be rid of her, or he would never speak to her again."
dying earth,The only way to save the Earth from extinction is to stop the Earth's population from exploding.,Yukon,Michael Jackson,Tanya Smith,"Michael and Tanyas Smith die from cancer, leaving Michael a bitter, vengeful man who blames himself for their death. With no one to turn to, he sets out to kill all the world's humans. He encounters a man named Peter O'Toole, a journalist who lives in a house with his pregnant wife and two young children.","In the end, it's all about Tanya. It's all a lie."
science fiction,"If it ain't broke, don't fix it.",Gotham,Batman,Candy's Cat,"Batman and Candy Cane's Cat were having a fun evening together when the Cat got hit by a truck, and was left with a nasty bruise on her head. It was then that Batman realized that the Cat's bruise was the result of a punch. With his mind made up, Batman decided to visit the Cat at the hospital and ask for the Cat to come with him to Gotham.","A new day, dawns on the streets of Gotham City."
the dark forest,"When the sun goes down, there is only one thing that can be done. Kill the sun.",Belfast,Patrick John McGovern,Gilly,"The day of the funeral, Patrick John and his son Gilly were out on the streets of Ballymoney, trying to catch up with the other mourners and make them laugh. On the way, they were confronted by a man who was selling candles on the side of the road. The two men had never met, but Patrick was quick to recognize the man as his old friend. The man was named Michael, the son of the woman Patrick killed, and his wife.",A man is the shadow of his past. A man is only a man because of all he has lost.
dystopian,"A man, born to a noble family, becomes an outcast and a vagrant in an underground city.",New York,Benjamin Franklin,Jill,"The Underground City of New York is the most dangerous place in the world and the only place where Benjamin Franklin can meet the girl of his dreams. The pair form an unlikely friendship and Franklin learns to become the architect of the city he dreamed of but never achieved, while Jill becomes an underground worker, trying to help Franklin with his experiments. But in the long run they must learn to work together if the city is to survive.","A Man, Born to a Noble Family, Becomes an Outcast and A Vagrant in the Underground City"
literary fiction,Let's put this away. Let's go home.,Boulder,Jack,Jenny L,"It was a beautiful spring day, as was the weather, and all three of them were happy. Jack looked out the window and saw a beautiful, warm day. A beautiful day for a picnic. ""They both looked out to see the mountain, and Jack saw his mother's house, and Jenny saw her father's house. It was like looking out on a day at the beach, only there was no sand and there were no waves."" ""They looked at each other, and they knew.",They had to go. The mountain was coming.
thrillers,They went from being the same person to not being the person they were.,Cotton County,Ralph,Jane,"As Jane got older and married, she became increasingly distant from Ralph. Their marriage wasn't a good fit, but they continued to live together in a house in Cotton, where they both worked. In the early 2000s, Jane became pregnant. Ralph's heart sank when he learned that Jane was having a baby and he became worried for his own son, David. One morning, Ralph took a bath and saw that David was gone. He was furious.","He wanted to make her feel better, but she had to take care of herself,"
the book of job,The best way to help a customer is to give them a reason to stay.,Germany,Boris Schick,Klara,"Boris Schick is a well-to-do American living a life of comfort and privilege in Germany. He has a successful career as a computer programmer, a stable marriage, and an attractive wife and two beautiful daughters. But the best way for a successful and successful person to help another person is to show them a way to succeed in their own way.",Boris Schick decided to help Klara. It wasn't long before he found out that he was the perfect match.
literary fiction,The only problem with the house was the people.,Spain,Ivan,Rosa,"They sat in the front yard, in the warm summer twilight, drinking beer and smoking cigarettes. Ivan, the father, was the one who was constantly saying, 'That's great! Let's have another one.' Rosa, the mother, had to be there, of course, for her son to do his homework and to give the boys a bath. But Ivan was so proud of his work on the house that he didn't think twice before calling Rosa in to watch him in action.",It was the day after the wedding that the first problems started.
erotica,"The man is a master at manipulating his environment, but in his case, his environment is his own body.",Germany,Karl,Klara,"It was a beautiful day. Karl and his wife Klara were walking around Munich on their way to a friend's birthday party. As they walked along, Karl thought he saw a car driving very close to them. He looked back, and sure enough, it was a car with a very familiar, sexy woman in it.","It took a few minutes, but eventually Karl and the lovely Klara got out of the car, and Klarin, too, got out to enjoy the nice day that they had been waiting for."
biblical epic,Never underestimate the power of the Bible.,North,Johann,Jenny,"Johann and Jenny, along with a gang of robbers, set out to steal the Holy Grail from the Holy Sepulcher of Jerusalem. The Grail is an item that grants the holder the power to fight the armies of the world. The thieves steal the Grail, but they end up in the hands of Jesus Christ, who grants the Holy Spirit to the thieves.","God can do all things, and through Him, all things are possible"
fantasy,The king of the gods.,Northwest Territories,Elliott,Anna. Elsa,"Elsa was a powerful woman who was the queen of the Northwest Territories. She loved her husband, Prince Andrew, and the two of them lived a wonderful life. Their son, Elliot, loved to be near the fire and the woods. Elliott loved to go for long walks with his father and play with the animals in the wild.","He wanted to be a warrior, he wanted to prove himself. But it was never his destiny to be the hero, he had to go along with his destiny."
science-fiction,A giant robot with wings is attacking the Earth. A scientist has been assigned to destroy it and save the Earth.,"Taos, NM",Jack,Hannah,"The main character Jack and his sister Hannah are students in high school in Tijuana, Mexico. While they love science fiction they can't stand the way the world is going now. Jack can see the danger that lies ahead. On a day when Jack sees the most powerful man in the world talking to the Prime Minister of the United States, Jack knows that something must be done to stop it. A giant robot is attacking Earth. An old enemy of the humans is attempting to take it over.",Jack and Hannah are forced to make a choice. The choice is to destroy the monster or destroy the Earth and humanity.
literary fiction,She said she'd never love him like that again,Boulder,John Smith,Hannah,"John Smith had come back from his latest trip to Boulder to find Hannah's room looking more like a bedroom than a home. Her bed was strewn with magazines, books, and clothes. The floor was littered with empty bottles and cigarette butts. In her window sat a poster of a young girl in her bedroom. John took the poster, opened it, and saw an empty spot on the floor. In his hand he held a red-stained glass, and he looked at the poster.","The girl was still gone. John found his voice, his anger, and his tears. He sat there, and the girl was gone. The room was quiet, still. Then the door slammed shut, and it was over."
cthulhu,A great and terrible and mysterious power is slowly and relentlessly working its way into the world.,Fayette County,Herschel Walker,Cindy,"It started when two friends, Herschel and Cindy Walker, decided to have some fun on a Saturday night. Herschel's brother had invited them to a party and as the three friends drank and gambled it came to pass that the bartender was playing a game of craps with one of the other patrons, Cindy Walker. That man was Cindy's husband, the man whose name was written in the sandstone tombstone that stood in the cemetery where Herschel died.",A Great and Terrible and Mysterious Power is Slowly and Eerily Working Its Way Into the World.
thrillers,The only person who could have stopped him was the girl with the blue dress.,Washoe County,Joe Miller,Aunt,"The girl with a blue dress is a character in a popular, if not very realistic, suspense fiction novel. She is the girlfriend of a man called ""Ricky"". ""She was the first woman to ever date Joe Miller, and it was the beginning of the end of his relationship with his Aunt. It was the end because she was the one person who couldn't be trusted. She had been a police officer, and she had seen the worst possible end to life.","But the end wasn't quite so bad. There's nothing like the feeling of being finally at peace. When Joe Miller finally went to sleep, the world was still there."
bodyscapes,A man who has spent all his money on drugs goes to prison for a long time.,Bran,Samwell Tarly,Fry's wife,"Bran II takes place on the continent of Westeros. In ""A Man who has Spent All His Money on Drugs Goes to Prison"", Samwell is back in Winterfell, as he has returned from his prison sentence, and he and his wife have a long conversation. They also learn that his son has been kidnapped by the Lannister forces and is held in a room with two guards.",A father with a son is not a happy man.
the dark forest,"When the sun goes down, there is only one thing that can be done. Kill the sun.",Lisbon,Jose,Joan,"Jose and Joan have been separated for a long time. Years ago, they fell in love and moved to Lisbon, a small but beautiful coastal city on the Iberian Peninsula. In Lisbon, the couple's love blossomed into a blossoming affair, and the two eventually decided to marry. They had the wedding they had always wanted and the wedding day was celebrated with the biggest party of the year. But something has changed in their marriage since their honeymoon.","The sun goes out, the world turns to pitch black, and a new world is born. Kill them both. Kill all of them."
scifi,It is the way of the universe. One cannot be a man and a god.,Detroit,Mike,Tanya Latta,"In the future, a city is being destroyed on a regular basis by a man-made disease called AIDS. A cure is not to be found. A mysterious figure is using his telekinetic powers to destroy the city. Mike and his wife Tanya have just had a child and are trying to get rid of the curse. To make their lives easier they are moving into the new building next door and they decide to put their child to bed while they are there.","There is a man in this house, he is a god,"
aeroplane,Aircraft are the most efficient forms of mass transport available in the 21st century,North Georgia,Drew Davis,Sandra Brown,"A young couple, Drew and Sandra, live on a small farm with their two young children in North Gwinnett. The kids go to school there and Drew and his brother run a small business selling small appliances to local homeowners. They have recently begun looking to buy a new farm. It is a nice enough place, a few acres of land with a house and a nice pasture for cattle and chickens.","The kids and their father had all but given up hope of ever finding a bigger farm, and they now faced a hard choice about the fate of their little farm."
the dark forest,The first step in the way was an unassuming forest path,Mendouville,Tom,Jasmine,"In a faraway land far away from the capital, Tom and his brother Jasmine were just beginning to explore their newly acquired talent of woodcraft. The two were sitting quietly as they enjoyed their day together. Jasmine was writing, a blank notebook resting on the table. As they watched her, Tom noticed a large, ancient tree, covered in leaves and vines, growing out of the earth, growing taller and taller as it grew, eventually reaching a height of thirty feet.","Tom and Jas' adventure has now been cut short by a mysterious force. However, they will not let this event deter them. Tom and Jasmine are determined to find out more about what has occurred and to get back to their own lives."
cthulhu,the first sign of the apocalypse was the disappearance of the last of the gods,Northwest Territories,Elliott,Sally,"Elliott and Sally's first meeting. They are on a long-overdue expedition to investigate the disappearance. When the expedition fails to find the missing god, their expedition is doomed to fail and they are forced to abandon the project. They will have to go it alone, with only their wits to keep them alive.","A new day is dawning and the sun is rising on the new, brighter, sun."
literary fiction,This was a moment of true tragedy.,Belfast,Paddy McNulty,Kitty,"Paddy McNully was the world's greatest detective. After all, he was the man who first found the secret of the mystery of Ireland"", and he was one of the first to discover that Mary Queen of Scots had a secret daughter, Mary Anne McShane. ""The two became lovers, and when Paddy died, Kitty was left without a soul, a victim of her own reckless lifestyle. It was then that she met Mary Anne, the sister of the murdered man.",Now she will be haunted by her past; the truth will slowly come out
biblical epic,"And when Jesus saw it, he was amazed; he fell on his face, and worshiped.",Boulder,Jack,Amber,"It's been a year since Jack and his family have been living in the same house. He has fallen in love with his step-sister Amber, who has had a crush on him since they were babies. When his brother, Ben, arrives to stay with the family, Ben is surprised to see Amber. He tries to seduce her but Jack catches on and stops him, telling Ben that Amber is too nice and sweet.","Jack is a very different person in this novel, as are the characters, so the end will not be like any of the others in the series, which makes it more challenging to write, but it is also an exciting way to end the book."
aeroplane,They can land a plane safely.,King,Josiah,Mary-Jane,"A King with a heart – Josiah tries to get the plane safely to the ground but Mary- Jane and the other passengers try to stop him.


The pilot has a difficult time landing the plane and has to abandon it. Josiah gets a job as a pilot.

The plane lands.

, the pilot's mother dies.

 of the plane crashing on purpose (that's a nice touch).","And in the windy weather, he took it down and got it to land."
scifi,It's just a few minutes of space travel. They've never had to deal with this before.,New York,Buck,Pamela,"The two of them, who were very much in love with each other, were on their way to New York City. They had to leave their little town in order to meet up with their friends at a party on the other side of the planet. They were planning to travel there with the goal of meeting up with the man she had been dating, Buck Adams, to begin a new life.","She didn't want to leave, not even for a minute. She had spent her whole life waiting to see this man, to be able to share his first kiss with her."
fantasy,The world is in the hands of a madman.,Afghanistan,Bashir,Poona,"Poona and Bashir return to the village of Khairkum to visit their father, who has been arrested by the Taliban for not being an Afghan Muslim. When Bashir learns of his father's arrest and that the government has no intention of freeing him, he returns to the camp and begins the preparations for a rescue mission. But in order to avoid being arrested for spying, he takes the opportunity to take a photograph of the Taliban commander.","It's a small thing, but it's a step forward."
