genre,theme,location,actor,actress,story,ending
the great american novel,The American Dream is dead.,Bexar County,J. Michael Hill,Jasmine,"Jasmine and J.Michael are two best friends from middle school who both grew up in the San Antonio, Texas area and are trying to find a good career path. They both believe they want to be actors and are working towards that goal. However, Jasmine's brother (Ryan) is more interested in a career as a veterinarian, and J-Michael is interested in becoming a doctor. Their lives collide when Jasmine receives an invitation to audition for a small local play.","It's a long way from the United States, Jas."
fiction,The first time she saw her was the second time she heard it. ,Germany,Boris Schick,Catherine,"On the eve of her nineteenth birthday, Catherine, who was on summer vacation in Germany, was walking along the river Wartburg with her mother and stepfather, when they stopped in the town of Düsseldorf. While Catherine was looking through the windows of their hotel, the window on her left caught her eye.","She looked up, her eyes bright with excitement, and saw her mother standing beside her. She ran up to her, and threw herself on her mother's lap, crying, "
aeroplane,The plane is not going to fly.,Northwest Territories,Elliott,Tanya,"The air force chief is a military genius. Elliott is a talented flight instructor. The two get along well and Tanya is a flight lieutenant. But the Chief and the flight lieutenant are about to find out that there is more to their friendship than meets the eye.
As of 2015, there were no more stories of the plane not going back on autopilot published in the Canadian press. This is not to say that it does not occur. The pilots are human and will make mistakes.",The Air Force Chief was about to board the plane. Elliott was there as well. He was waiting. He saw the plane take off. The plane disappeared.
fantasy,The king of the gods.,Palo Alto,Alex,Alice,"In an effort to win the heart of the princess, the king of a neighboring kingdom decided to travel to Palo Alto to marry the princess' older brother. His father, King Alex, was forced to travel with him. As the prince passed through Palo Alto, he met a strange girl, Alice.
Alex and Alice lived together in the same room. She told him stories of her own adventures with her own king and kingdom.",The King and Princess are married and live happily ever after...and all is well.
cinema,"The Doctor must leave London and take on a new companion, but the time is right.",Mack,Trevor Knight,Jane O'Brien,"The TARDIS arrives in Mack to find the streets in turmoil. It's been years since the Doctor has visited Mack and his absence has left a power vacuum. The Doctor discovers that this power vacuum is actually the cause of the chaos, a conspiracy involving two former friends, the Master and Davros, who has been causing a rift in the fabric of time and space. He needs to return to the city where he met Jane.",It's a good thing the Doctor was here.
science-fiction,The first and the last man had to die.,"Taos, NM",George William Miller III,Holly,"George William Miller has never quite figured out what to make of his father. He can't seem to shake the feeling that he doesn't really know him. George is more than just a son, his mother Holly is his mother as well. After their mother dies of illness, George's life is forever changed when he meets Holly. When she and George first get together, George finds out that she was a woman named Holly. They are both the last and the first man in a long line.",The last man to die has to pay for his sins.
science-fiction,The only way to defeat the enemy is to become the enemy.,King County,John Smith,Cecily,"It is early on the third day of a battle against an enemy that seems insurmountable. On the previous day, John Smith, Cecily Farrow and John Taggart, all under the age of sixteen, were lost to their families. Cecily's life had been saved, and the entire world hoped that she would be able to come home and make a new life for herself.","It was the last day of the war. Cecilias was still in her bedroom, the war was lost. She heard a knock, and it was John T. Smith. "
literary fiction,A young boy is thrown in a labyrinth and has to solve his own murders.,Yukon,John Smith,Tanya Smith,"As soon as John Smith was born, it was decided that he would be sent away. There was some concern about this, because the boy was a girl, but in the end it was determined that the world was full of dangerous people, so it made sense to get rid of him. At the age of seven, John disappeared from her life and was replaced by a little boy named Tanya.",The young boy had to solve the mysteries of the labyrinth in his own way.
drama,The real world is a very hard place to get things done.,Cotton County,John Smith,Sophia,"In 1826, John Smith, a black man from North Carolina, had just purchased a large farm and planned to run it as a plantation. But the land owner had a different idea and demanded that he and Sophia move to the cotton country. Smith took his wife's brother's advice and left the farm to live in the cotton town of Pemiscot. It wasn't long before he met Sophia, who was working as a maid for a prosperous cotton owner.",Sophia is a smart and tough girl. She is smart and she wants to be smart.
science-fiction,The first and the last man had to die.,Washoe County,Garry,Dori,"Garry is a former war hero who is now a private investigator, and he and his wife Dori live in Washo County. When a body is found, Garry suspects a serial killer and begins investigating. When his wife is killed, he is forced to do more than just investigate; he must confront the evil that was his wife's killer and the demons he unleashed.",It had come to this. It was over. He didn't want the monster back. He wanted the monster gone.
mystery,The Man Who Could See.,Afghanistan,Bashir,Maryam Bibi,"Maryam and Bashir were in a remote corner of Kabul on August 19th, 2001. Their two children, a two-year-old boy and a six-year old girl were on a bicycle, with Maryam holding the infant on her back. A man drove up to them. He had a pistol in his hand, but he didn't fire.",Maryam and her children were left with no choice but to get on a bus and leave the city of Kabul.
dying earth,Be careful with the dead!,Afghanistan,Samiullah,Poona,"The war in Afghanistan is about to end, and the dead are coming for Poonam. With her husband Samiulam in jail and a family on the brink of disaster, Poonai is now forced to make an extraordinary choice about her family's future. What if she goes into hiding and joins the dead, risking her life on a perilous journey to the border of a dangerous, hostile country?","Don't be afraid, don't be scared. This war is just over,"
the great american novel,"The American Dream, or the Dream of America",Yukon,Michael Jackson,Gabby,"When the U.S. government shut down, Gabby was given the choice of going home or staying and becoming a full-time teacher, but she chose to stay and become an instructor at a local high school. Her new job required her to work with Michael. However, Gabi's parents, who both hold the title of Dr."" at the school, had their own problems. They were both on trial for murdering a student.","The end is an allegory for the Ugly Truth about a person who chooses not to change for the better, a person whose true desires will always be selfish."
erotica,"The man is a master at manipulating his environment, but in his case, his environment is his own body.",Alameda County,John,Minnie,"There's a girl he's fallen for, John. She's not his type, and it has taken him a long time to get over her, but he still has a passion for her. John's always been very good at getting what he wants and getting it quickly, but his mind's always drifting and that's when the trouble starts. But when John meets Minnie, he can't stop himself. He wants to do everything he can to get closer to her.","John is a man of many dreams and aspirations, but only one is the thing that's truly important. And he's never going to let Minnie down again."
thrillers,"In a time of uncertainty, the world needs more heroes.",Washoe County,Tom Smith,Tia Oke,"Tom Smith and his son Tia are the only hope the Washoe Valley has. A young boy has his mother killed while on a mission, his father becomes the next person in the line of fire and he is the one who will stop it. Tom becomes his father's hero, as he fights to keep his son alive as the threat looms large. He will be the only one who can stop the killer.","In the end, when all hope seems lost, Tom and TIA find that they have become a family of their own."
erotica,"The man is a master at manipulating his environment, but in his case, his environment is his own body.",King,Josiah,The girl,"Josiah and the girl in his life are in a deep, deep, love triangle. Josiah wants to take a chance with The girl, but he is terrified that he might lose her in the process. After all, he's not a very good man.",The girl finds herself in a very dark and very strange place...she finds it easier to hide than to reveal herself. She has to find a way out and soon. And she will do whatever it takes to find it.
literary fiction,She said she'd never love him like that again,Kathmandu,The Chief,Shantu,"It was a cold morning. Shantu's car was running late. He'd been working all night, and had only managed to get to the office by the time the traffic police started their morning rounds. He was late again, and his car was about to be impounded by the traffic cops. He turned the ignition to the off position, and stepped out of his car. He looked out the window and saw a young woman walking down the street.","She stepped off the sidewalk, walked up to the car, and turned off the ignition,"
haunt,"A man is on his way to the cemetery, and he sees a man walking the cemetery.",King County,Toby,Bella C,"Toby and Bella's family was killed in a fire on their farm. They were buried in the cemetery at night, but they can still hear the screaming and feel the heat of the fire. Their house is destroyed, and they find themselves wandering the cemetery in search of answers to their family's fate. When they find a coffin in the graveyard, they discover the body of a man with a scar on his forehead, a wound on his side, and a bullet hole in his cheek.","The coffin opens and the man is gone. The fire is still there, but now the smoke is gone and there is no heat. He doesn't look like he was killed by the fire, but he is."
science fiction,It was just another day on the job.,San Francisco,John Smith,Ruth,"It all began with John Smith, a hard-drinking, hard-living, foul-mouthed, foulmouthing alcoholic who, after his wife left him, was fired from a high-paying job with the city of San Francisco. But, with his new found freedom, John Smith decides that he'll try to take over as the city's new police commissioner. But just as his plan begins to work, Ruth (a beautiful, intelligent woman with a strong will)","They all get up on the stage and sing. A song they all learned together. They sing a song that speaks of love, and hope, and the possibility of a new future."
aeroplane,The plane is not going to fly.,United Arab Emirates,Yemen,Katherine,"A flight from New York to Dubai takes off under the control of its captain, who is being monitored by the government. The plane lands without incident at an airport in the UAE and a group of Yemenis arrive to witness its departure. The Yemeni passengers take a seat on the plane, and the flight crew leaves. The two young Yemenis on board the plane are Katherine and Khalid al-Hariri, the daughter of President Ali Abdullah Saleh.","Katherine is an excellent student, but in her head the girl is a little like her mother,"
bodyscapes,Don't try to draw a straight line.,Detroit,David Smith,Beverly,"This was not a good day for David Smith. The two women were in a car together, driving south on the Woodward Avenue bridge, when Beverly hit a curb and was struck by a vehicle.
As Beverly was thrown from her car, she smashed her head into a building, causing a fatal brain injury to her. David, her boyfriend, drove her home, where she died.",A man was in the middle of his business on the street when David Smith came out of the darkness and grabbed him.
aeroplane,They can land a plane safely.,King County,John,Buffy Summers,"John and Buffy are married, and she has a new job as a Flight Controller in Seattle.
The couple flies out of Seattle in an old Piper Cub and is met with an ominous warning of a crash landing in a local park. Buffy and John's son is also on the plane.
They land on a local road at night. A man in a car is watching them as he runs off. The man later turns up dead.","A few years after they left, John and his son were married in a Catholic Church and he became a priest,"
the book of job,The best way to help a customer is to give them a reason to stay.,Detroit,Sam Jones,Cecilia,"Sam's boss, Cecilia, takes over the company after Sam leaves. Sam is excited to work with the new management, but the problems start immediately. Cecilia is a very strict manager who expects all her workers to comply with her every word. Her strictness gets on Sam's nerves, but Sam isn't sure what else to do.
""Cecilia's strictness is especially on Sam.","There are some things a customer doesn't want to be told, and Cecily is one of them. But Sam isn´t sure he wants Cecily to see him like that."
literary fiction,Let's put this away. Let's go home.,Lisbon,Jose,Joan,"The two men were in the library, reading the newspaper when they suddenly realized they were being followed by a man who was not one of them.
The man's face was that of a man, and it was a beautiful face.
In the library the man kept looking at the man in the blue suit and Joan and Jose stared at him.
When the man stopped looking at them, Jose and his friend looked at him, too. They saw that he was a man.","He did not go to the police. He did not call his brother.
He did go home and he did cry. The man in blue had a smile on his face."
scifi,It's just a few minutes of space travel. They've never had to deal with this before.,Germany,Boris Schick,Catherine,"Boris Schick was an artist who lived and worked in Berlin. He was in his mid-fifties. His work was extremely original and brilliant. He had a tendency to be very passionate about anything he worked on. The only thing that stood between him and a happy, successful life was his wife Catherine. He loved her and wanted to spend his life with her, but she always seemed to have the upper hand.",It was a normal day. Boris was working on an exhibition in his studio when he heard a knock on the door.
the book of job,"The key to job creation is to focus on the 'what' first,",Northwest Territories,James T. Allen,Molly,"A new company, Northwest Territories Development Company (Nydco), is in need of new management. After hiring James T, a successful young CEO from the West, the company plans to begin construction on a new project in the heart of the Northwest Territories. The project is the construction of a power plant that will provide electricity to all of the territory's rural communities. Nydco also plans to hire a new manager to run the project.","As the old saying goes, it's good to start out with a big bang."
mystery,What does that mean?,Fayette County,Trevor Adams,Karen,"Karen was at work when she heard from Trevor that she had been selected to work for an organization. She got a call a few hours later telling her that they had an urgent matter. She went in for an interview and found a man who was supposed to meet with her in a few days to discuss the matter. The next day, Karen was called into a conference room. The man told her that she was not to mention the matter to anyone else, and she would be dismissed.","In the end, Trevor has a plan. And he has it in his head. That he's going to get rid of his past."
bodyscapes,A man who has spent all his money on drugs goes to prison for a long time.,King,Josiah,Tinasha,"When the gang leader Josiah returns from prison, it's not long before he has the local drug dealer Tinasha on the ropes. She's also on her way to an arranged marriage to a drug kingpin, but when Josiah finds out about the affair, his anger leads to a gunfight and Tin Sasha's murder.",A young man in prison for years has his life turned around when he is brought to meet a girl he has fallen in love with. The man's life is saved and he's given hope.
thrillers,They went from being the same person to not being the person they were.,New York City,Tom Ferebee,Aubrie,"The two former partners were working with an ambitious private investigator named Tom Ferenbee. But while Ferebie was making headway in catching a murderer in his own city, Aubrie and his brother were falling apart. They began a relationship that, although romantic at the time, was no longer satisfying to them.","Tom is forced to confront his old feelings for his long lost lover when he witnesses the murder of his partner, and is left with a terrible feeling about what they are all still going through."
fiction,Never trust a man who is not smiling.,Germany,Boris Schick,Catherine,"As a young man, Boris Schicker had a knack for the dramatic, a gift that would serve him well in his new role as an officer in the SS. He had the perfect looks and a perfect smile. He was tall, with blue eyes and a full, rosy complexion. When he met Catherine, she looked nothing like the beautiful woman he knew from his high school days. But he had never met a woman like Catherine. They immediately hit it off.","It was at the end of May 1941, just before the Battle of Britain began, that Catherine Schicker was finally taken off the ship and put aboard the Lusitania."
literary fiction,A young boy is thrown in a labyrinth and has to solve his own murders.,Alameda County,John T. Smith,Sarah,"The boy was a very bright child, he was a good student in school, and he was always cheerful. In addition, he and his brother were the oldest children of a wealthy family. When his parents retired, they left John, Sarah, and the house to the two of them, but never did anything to make John or Sarah happy. Sarah had become a bitter woman and the boy seemed to suffer from depression and anxiety.","But the door was closed, and there was nothing anyone could do. Sarah closed her eyes and fell into a deep, dreamless sleep."
novel for kids,The girl who loves the sun.,Belfast,Theodore Roosevelt,Tiffany,"Tiffany and Theodore are the best of friends, and they are not the only ones. Tiffany's boyfriend, Peter, was killed in a car accident, and Theodore had a girlfriend who had just broken up with him. As a result, he is determined to find out who killed Peter and find her so that he can get revenge on the people who murdered him.","Tiffany, the girl who really loves the light...
"
cthulhu,the first sign of the apocalypse was the disappearance of the last of the gods,Rome,Pius XII,Julia,"In the year 1612, Pope Pius II was exiled by an alliance of Italian factions, including the one that overthrew him. This faction included the pope's brother, the future Pope Urban II. The exiled pope moved to the Italian city of Rome, where the last vestiges of the Vatican remained. Here, the pope began a new papal career as an ascetic and the first sign that the apocalypse would be upon us was the disappearing of the Last of the Gods.","A new world, one not of gold and silver, but of gold, silver, and the smell of burning sulfur. The world that is. The new world has been born. It will rise out of the ashes and burn the ashes."
cthulhu,The Necronomicon,King County,John,Jane,"The two of them were walking home from a bar, Jane's arm around John's shoulders, when they stopped suddenly and looked up. It was a small, dark street lined with houses in different styles and designs. On the corner, a row of shops had a sign that said The Library"" and were full of people reading, and some were even writing or talking to each other.","John said.
He looked down at Jane, who had closed her eyes for a moment. She had no expression, but she seemed to be thinking. "
aeroplane,Aircraft are the most efficient forms of mass transport available in the 21st century,Detroit,Sam Jones,Amber Lee,"It had been two years since the world had seen the great Sam Jones, or Amber Lee. He was a fighter pilot, but that had been a while. For the past few months, he had been the most experienced pilot in the world – and now he was a passenger on an aeroplaineer that would take him across the Atlantic to America. They had been told it would be an easy trip. It had, of course, been nothing of the kind.","A large, old plane had just landed in the middle of the desert, with a huge, heavy man on board. He looked like a man out of a nightmare. He had his helmet off, but he was staring straight at Sam."
novel for kids,A child's best friend. A dog that is always loyal and gentle.,"Taos, NM",George William Miller III,Tasha,"George William Miller is a quiet, well-mannered teenager who wants to live in Tijuana with his mother, a schoolteacher in a tiny town, but his mother refuses. Instead, he decides to move in with his younger sister Tasha, a high-school dropout who has just moved to town with her boyfriend, George's older brother, Billy.","It was not a long night. In fact, it was only three days, for the last three nights of the spring term the two of them had been asleep with the door locked and the blinds drawn."
mystery,The Man Who Could See.,South Sudan,Mason Davis,Rita,"Mason Davis, a high-ranking U.N. official, and his family travel to South Sudan for a mission. After arriving in the country, he and Rita Davis, his wife, begin their stay as guests in a small town. In the beginning, they feel that they have found the ideal place to live, with everything they need. But soon their happiness is put on hold when they realize the place is a hotbed of corruption, violence and a growing rebellion.","Rita died. There is a picture of her. It is a family picture, taken at her funeral."
science fiction,"If it ain't broke, don't fix it.",San Francisco,The Captain,Hilda,"The Captain is a space-faring, female, human-hating, time travelling, sentient robot who is part of the resistance against the evil alien race, The Covenant, which has invaded Earth and is attempting to conquer the human race. Hilda is a highly intelligent, female alien who was kidnapped as a child and was trained as a soldier. During her captivity, the Covenant had brainwashed her, and has been trying to take over the Earth ever since.","They're not here. The Captain got away, but they're still on Earth, and they're not alone."
science-fiction,"It is the future, so don't be a moron about this.",Gotham,Batman,Batgirl,"It Is the Future, So Don't Be a Moron About This.
In this future Gotham City, crime and corruption are rampant. As a means of coping with this, Batman enlists the help of Batgirl, who helps him stop the villain, Black Mask. Batgirl is a highly skilled and athletic young girl who is very strong. She has trained herself in martial arts, which is not a coincidence.",But Batman isn't in the future. He is in the present.
dark fantasy,"It's a tale of the dead,",Yukon,John Doe,Gabby,"John Doe and his girlfriend, Gabby, are the last ones of their town. After losing all their friends and loved ones, they find each other in the middle of a forest clearing in the dead of winter.
The two are stranded. John and Gab are alone. The forest is a strange place. In the dead winter they have to find a way to get home. But the world is different this year.","It is a tale that begins with the last person to die in the town of Linton, Illinois, but ends with the second to die, a young woman named Gabby."
dying earth,It is a very interesting way to show a dying world.,Seattle,Dwayne Thomas Davis,Sally,"Dwayne Thomas and Sally are a couple of guys in their 50s in a very boring job working for an oil company, their marriage is on the rocks, and when Sally is diagnosed with cancer they decide to leave Seattle and head to the coast. But after a night on the town Dwayne gets drunk and gets into a fight with his wife. The fight breaks her leg, Dwayne then throws her to the ground, but then gets arrested.","It's very interesting to be in a world in which there are still places and places where human beings can survive,"
mystery,One day at a time.,Mendouville,James Michael McNeil,Katarina,"The two of them live a peaceful life, living in Mendoza, when James Michael comes to visit Katarinas father for the weekend.
However, things don't quite go as James wants. He is kidnapped by a man known as 'Mr. H' and taken to a room at a local motel.
While James is being held captive, Mr. H takes pictures of him and his sister and then takes James to the beach where they are both brutally raped.","After being raped, James Michael was sent back to his father's house."
bodyscapes,All men are brothers.,Spain,John Brown,Diana Sanchez,"When a Spanish girl is taken hostage by a madman who is looking for Diana Sanchez, John Brown is sent to the remote mountain town where she was held captive in the hopes that a local band of brothers could provide a way to free her. But John is no simple knight. He is a man who's dedicated his life to the protection of the innocent and the protection and defense of the downtrodden, and now he must find a way that both groups can be reconciled.",Diana Sanchez was not a woman who had lost her mind. She had been a real human being.
